{
  "schema_version": "ts-explorer-workspace-snapshot/1",
  "workspace_id": "ws_fixture",
  "changed": true,
  "scientific_changed": true,
  "operational_changed": false,
  "workspace_revision": "sha256:aaaaaaaaaaaaaaaaaaaaaaaaaaaaaaaaaaaaaaaaaaaaaaaaaaaaaaaaaaaaaaaa",
  "operational_revision": "sha256:bbbbbbbbbbbbbbbbbbbbbbbbbbbbbbbbbbbbbbbbbbbbbbbbbbbbbbbbbbbbbbbb",
  "workspace": {
    "workspace_id": "ws_fixture",
    "label": "fixture",
    "available": true,
    "load_error": null
  },
  "view": {
    "schema_version": "ts-web-workspace/6",
    "workspace_revision": "sha256:aaaaaaaaaaaaaaaaaaaaaaaaaaaaaaaaaaaaaaaaaaaaaaaaaaaaaaaaaaaaaaaa",
    "operational_revision": "sha256:bbbbbbbbbbbbbbbbbbbbbbbbbbbbbbbbbbbbbbbbbbbbbbbbbbbbbbbbbbbbbbbb"
  },
  "graph": {
    "schema_version": "ts-explorer-graph/6",
    "workspace_revision": "sha256:aaaaaaaaaaaaaaaaaaaaaaaaaaaaaaaaaaaaaaaaaaaaaaaaaaaaaaaaaaaaaaaa",
    "operational_revision": "sha256:bbbbbbbbbbbbbbbbbbbbbbbbbbbbbbbbbbbbbbbbbbbbbbbbbbbbbbbbbbbbbbbb"
  }
}
